{
  "$id": "commerce.rule.cartIdentityStable",
  "name": "Cart Identity Stable",
  "version": "0.13.0",
  "status": "stable",
  "domain": "commerce",
  "category": "cart-checkout",
  "ruleKind": "state-and-commit-guard",
  "description": "A Cart keeps one stable identity throughout its mutable lifecycle and is not replaced merely because lines or totals change.",
  "purpose": "A Cart keeps one stable identity throughout its mutable lifecycle and is not replaced merely because lines or totals change.",
  "severity": "standard",
  "configurable": false,
  "appliesTo": [
    "commerce.cart"
  ],
  "enforcement": {
    "authority": "server",
    "timing": "before-commit",
    "atomicWhenRequired": false,
    "auditRequired": false,
    "clientValidationOnly": false
  },
  "requirements": [
    {
      "id": "commerce.rule.cartIdentityStable.R1",
      "description": "A Cart keeps one stable identity throughout its mutable lifecycle and is not replaced merely because lines or totals change."
    },
    {
      "id": "commerce.rule.cartIdentityStable.R2",
      "description": "The rule must be evaluated from authoritative server-side state and must not trust browser-calculated or provider-reported state without required validation/reconciliation."
    }
  ],
  "failure": {
    "code": "COMMERCE_RULE_VIOLATION",
    "retryable": false,
    "customerSafe": true,
    "notes": "Phase 12 defines the domain error identifier. HTTP mapping and response envelopes are reserved for Phase 18."
  },
  "relationships": [
    {
      "type": "governs",
      "target": "commerce.cart",
      "description": "This rule constrains commerce.cart operations or state."
    }
  ],
  "examples": {
    "valid": [
      "An operation involving commerce.cart satisfies the rule before authoritative state is committed."
    ],
    "invalid": [
      "An implementation bypasses commerce.rule.cartIdentityStable and commits a conflicting or unverifiable state."
    ]
  },
  "implementationNotes": [
    "Enforce at the server-side commerce domain boundary.",
    "Use canonical Phase 11 schemas as the data model; do not create shadow transaction models.",
    "If provider behavior differs, translate through an adapter and reconcile to canonical NEXT F state."
  ],
  "futureBindings": {
    "events": "phase-13",
    "webhooks": "phase-14",
    "permissions": "phase-15",
    "siteManifest": "phase-16",
    "api": "phase-18"
  }
}
