{
  "$id": "commerce.rule.orderHistoricalSnapshotsImmutable",
  "name": "Order Historical Snapshots Immutable",
  "version": "0.13.0",
  "status": "stable",
  "domain": "commerce",
  "category": "orders",
  "ruleKind": "order-invariant",
  "description": "Order customer, address, line, price, discount, tax and source snapshots remain historical facts after Order creation.",
  "purpose": "Order customer, address, line, price, discount, tax and source snapshots remain historical facts after Order creation.",
  "severity": "critical",
  "configurable": false,
  "appliesTo": [
    "commerce.order",
    "commerce.orderAddressSnapshot",
    "commerce.orderLine",
    "commerce.orderSource"
  ],
  "enforcement": {
    "authority": "server",
    "timing": "before-and-after-transition",
    "atomicWhenRequired": true,
    "auditRequired": true,
    "clientValidationOnly": false
  },
  "requirements": [
    {
      "id": "commerce.rule.orderHistoricalSnapshotsImmutable.R1",
      "description": "Order customer, address, line, price, discount, tax and source snapshots remain historical facts after Order creation."
    },
    {
      "id": "commerce.rule.orderHistoricalSnapshotsImmutable.R2",
      "description": "The rule must be evaluated from authoritative server-side state and must not trust browser-calculated or provider-reported state without required validation/reconciliation."
    }
  ],
  "failure": {
    "code": "COMMERCE_RULE_VIOLATION",
    "retryable": false,
    "customerSafe": true,
    "notes": "Phase 12 defines the domain error identifier. HTTP mapping and response envelopes are reserved for Phase 18."
  },
  "relationships": [
    {
      "type": "governs",
      "target": "commerce.order",
      "description": "This rule constrains commerce.order operations or state."
    },
    {
      "type": "governs",
      "target": "commerce.orderAddressSnapshot",
      "description": "This rule constrains commerce.orderAddressSnapshot operations or state."
    },
    {
      "type": "governs",
      "target": "commerce.orderLine",
      "description": "This rule constrains commerce.orderLine operations or state."
    },
    {
      "type": "governs",
      "target": "commerce.orderSource",
      "description": "This rule constrains commerce.orderSource operations or state."
    }
  ],
  "examples": {
    "valid": [
      "An operation involving commerce.order, commerce.orderAddressSnapshot satisfies the rule before authoritative state is committed."
    ],
    "invalid": [
      "An implementation bypasses commerce.rule.orderHistoricalSnapshotsImmutable and commits a conflicting or unverifiable state."
    ]
  },
  "implementationNotes": [
    "Enforce at the server-side commerce domain boundary.",
    "Use canonical Phase 11 schemas as the data model; do not create shadow transaction models.",
    "If provider behavior differs, translate through an adapter and reconcile to canonical NEXT F state."
  ],
  "futureBindings": {
    "events": "phase-13",
    "webhooks": "phase-14",
    "permissions": "phase-15",
    "siteManifest": "phase-16",
    "api": "phase-18"
  }
}
