{
  "$id": "commerce.rule.commerceTenantIsolation",
  "name": "Commerce Tenant Isolation",
  "version": "0.13.0",
  "status": "stable",
  "domain": "commerce",
  "category": "security-audit",
  "ruleKind": "security-invariant",
  "description": "Every commerce read/write must enforce Organization/Site scope server-side; caller-supplied IDs do not establish authorization.",
  "purpose": "Every commerce read/write must enforce Organization/Site scope server-side; caller-supplied IDs do not establish authorization.",
  "severity": "critical",
  "configurable": false,
  "appliesTo": [
    "core.tenantScope",
    "commerce.order",
    "commerce.commerceCustomer"
  ],
  "enforcement": {
    "authority": "server",
    "timing": "every-applicable-operation",
    "atomicWhenRequired": true,
    "auditRequired": true,
    "clientValidationOnly": false
  },
  "requirements": [
    {
      "id": "commerce.rule.commerceTenantIsolation.R1",
      "description": "Every commerce read/write must enforce Organization/Site scope server-side; caller-supplied IDs do not establish authorization."
    },
    {
      "id": "commerce.rule.commerceTenantIsolation.R2",
      "description": "The rule must be evaluated from authoritative server-side state and must not trust browser-calculated or provider-reported state without required validation/reconciliation."
    }
  ],
  "failure": {
    "code": "COMMERCE_TENANT_SCOPE_VIOLATION",
    "retryable": false,
    "customerSafe": false,
    "notes": "Phase 12 defines the domain error identifier. HTTP mapping and response envelopes are reserved for Phase 18."
  },
  "relationships": [
    {
      "type": "governs",
      "target": "core.tenantScope",
      "description": "This rule constrains core.tenantScope operations or state."
    },
    {
      "type": "governs",
      "target": "commerce.order",
      "description": "This rule constrains commerce.order operations or state."
    },
    {
      "type": "governs",
      "target": "commerce.commerceCustomer",
      "description": "This rule constrains commerce.commerceCustomer operations or state."
    }
  ],
  "examples": {
    "valid": [
      "An operation involving core.tenantScope, commerce.order satisfies the rule before authoritative state is committed."
    ],
    "invalid": [
      "An implementation bypasses commerce.rule.commerceTenantIsolation and commits a conflicting or unverifiable state."
    ]
  },
  "implementationNotes": [
    "Enforce at the server-side commerce domain boundary.",
    "Use canonical Phase 11 schemas as the data model; do not create shadow transaction models.",
    "If provider behavior differs, translate through an adapter and reconcile to canonical NEXT F state."
  ],
  "futureBindings": {
    "events": "phase-13",
    "webhooks": "phase-14",
    "permissions": "phase-15",
    "siteManifest": "phase-16",
    "api": "phase-18"
  }
}
