{
  "$id": "commerce.rule.taxRateSnapshot",
  "name": "Tax Rate Snapshot",
  "version": "0.13.0",
  "status": "stable",
  "domain": "commerce",
  "category": "tax",
  "ruleKind": "tax-invariant",
  "description": "A committed transaction records the tax rate/amount basis used at that time rather than depending on future Tax Rate configuration.",
  "purpose": "A committed transaction records the tax rate/amount basis used at that time rather than depending on future Tax Rate configuration.",
  "severity": "critical",
  "configurable": false,
  "appliesTo": [
    "commerce.taxRate",
    "commerce.taxLine",
    "commerce.order"
  ],
  "enforcement": {
    "authority": "server",
    "timing": "before-commit",
    "atomicWhenRequired": true,
    "auditRequired": true,
    "clientValidationOnly": false
  },
  "requirements": [
    {
      "id": "commerce.rule.taxRateSnapshot.R1",
      "description": "A committed transaction records the tax rate/amount basis used at that time rather than depending on future Tax Rate configuration."
    },
    {
      "id": "commerce.rule.taxRateSnapshot.R2",
      "description": "The rule must be evaluated from authoritative server-side state and must not trust browser-calculated or provider-reported state without required validation/reconciliation."
    }
  ],
  "failure": {
    "code": "COMMERCE_RULE_VIOLATION",
    "retryable": false,
    "customerSafe": true,
    "notes": "Phase 12 defines the domain error identifier. HTTP mapping and response envelopes are reserved for Phase 18."
  },
  "relationships": [
    {
      "type": "governs",
      "target": "commerce.taxRate",
      "description": "This rule constrains commerce.taxRate operations or state."
    },
    {
      "type": "governs",
      "target": "commerce.taxLine",
      "description": "This rule constrains commerce.taxLine operations or state."
    },
    {
      "type": "governs",
      "target": "commerce.order",
      "description": "This rule constrains commerce.order operations or state."
    }
  ],
  "examples": {
    "valid": [
      "An operation involving commerce.taxRate, commerce.taxLine satisfies the rule before authoritative state is committed."
    ],
    "invalid": [
      "An implementation bypasses commerce.rule.taxRateSnapshot and commits a conflicting or unverifiable state."
    ]
  },
  "implementationNotes": [
    "Enforce at the server-side commerce domain boundary.",
    "Use canonical Phase 11 schemas as the data model; do not create shadow transaction models.",
    "If provider behavior differs, translate through an adapter and reconcile to canonical NEXT F state."
  ],
  "futureBindings": {
    "events": "phase-13",
    "webhooks": "phase-14",
    "permissions": "phase-15",
    "siteManifest": "phase-16",
    "api": "phase-18"
  }
}
