{
  "$id": "commerce.rule.fulfillmentQuantityBound",
  "name": "Fulfillment Quantity Bound",
  "version": "0.13.0",
  "status": "stable",
  "domain": "commerce",
  "category": "fulfillment",
  "ruleKind": "fulfillment-invariant",
  "description": "A Fulfillment line quantity cannot exceed the Order line quantity still eligible for fulfillment.",
  "purpose": "A Fulfillment line quantity cannot exceed the Order line quantity still eligible for fulfillment.",
  "severity": "critical",
  "configurable": false,
  "appliesTo": [
    "commerce.fulfillment",
    "commerce.fulfillmentLine",
    "commerce.orderLine"
  ],
  "enforcement": {
    "authority": "server",
    "timing": "before-and-after-fulfillment-transition",
    "atomicWhenRequired": true,
    "auditRequired": true,
    "clientValidationOnly": false
  },
  "requirements": [
    {
      "id": "commerce.rule.fulfillmentQuantityBound.R1",
      "description": "A Fulfillment line quantity cannot exceed the Order line quantity still eligible for fulfillment."
    },
    {
      "id": "commerce.rule.fulfillmentQuantityBound.R2",
      "description": "The rule must be evaluated from authoritative server-side state and must not trust browser-calculated or provider-reported state without required validation/reconciliation."
    }
  ],
  "failure": {
    "code": "COMMERCE_FULFILLMENT_QUANTITY_EXCEEDED",
    "retryable": false,
    "customerSafe": true,
    "notes": "Phase 12 defines the domain error identifier. HTTP mapping and response envelopes are reserved for Phase 18."
  },
  "relationships": [
    {
      "type": "governs",
      "target": "commerce.fulfillment",
      "description": "This rule constrains commerce.fulfillment operations or state."
    },
    {
      "type": "governs",
      "target": "commerce.fulfillmentLine",
      "description": "This rule constrains commerce.fulfillmentLine operations or state."
    },
    {
      "type": "governs",
      "target": "commerce.orderLine",
      "description": "This rule constrains commerce.orderLine operations or state."
    }
  ],
  "examples": {
    "valid": [
      "An operation involving commerce.fulfillment, commerce.fulfillmentLine satisfies the rule before authoritative state is committed."
    ],
    "invalid": [
      "An implementation bypasses commerce.rule.fulfillmentQuantityBound and commits a conflicting or unverifiable state."
    ]
  },
  "implementationNotes": [
    "Enforce at the server-side commerce domain boundary.",
    "Use canonical Phase 11 schemas as the data model; do not create shadow transaction models.",
    "If provider behavior differs, translate through an adapter and reconcile to canonical NEXT F state."
  ],
  "futureBindings": {
    "events": "phase-13",
    "webhooks": "phase-14",
    "permissions": "phase-15",
    "siteManifest": "phase-16",
    "api": "phase-18"
  }
}
