{
  "$id": "commerce.rule.subscriptionCapabilityGate",
  "name": "Subscription Capability Gate",
  "version": "0.13.0",
  "status": "stable",
  "domain": "commerce",
  "category": "specialized-capabilities",
  "ruleKind": "capability-gate",
  "description": "Recurring billing/subscription behavior requires a dedicated approved Subscription capability contract before production use; ordinary Order/Payment schemas are insufficient.",
  "purpose": "Recurring billing/subscription behavior requires a dedicated approved Subscription capability contract before production use; ordinary Order/Payment schemas are insufficient.",
  "severity": "critical",
  "configurable": false,
  "appliesTo": [
    "commerce.product",
    "commerce.payment"
  ],
  "enforcement": {
    "authority": "server",
    "timing": "before-capability-use",
    "atomicWhenRequired": true,
    "auditRequired": true,
    "clientValidationOnly": false
  },
  "requirements": [
    {
      "id": "commerce.rule.subscriptionCapabilityGate.R1",
      "description": "Recurring billing/subscription behavior requires a dedicated approved Subscription capability contract before production use; ordinary Order/Payment schemas are insufficient."
    },
    {
      "id": "commerce.rule.subscriptionCapabilityGate.R2",
      "description": "The rule must be evaluated from authoritative server-side state and must not trust browser-calculated or provider-reported state without required validation/reconciliation."
    }
  ],
  "failure": {
    "code": "COMMERCE_RULE_VIOLATION",
    "retryable": false,
    "customerSafe": true,
    "notes": "Phase 12 defines the domain error identifier. HTTP mapping and response envelopes are reserved for Phase 18."
  },
  "relationships": [
    {
      "type": "governs",
      "target": "commerce.product",
      "description": "This rule constrains commerce.product operations or state."
    },
    {
      "type": "governs",
      "target": "commerce.payment",
      "description": "This rule constrains commerce.payment operations or state."
    }
  ],
  "examples": {
    "valid": [
      "An operation involving commerce.product, commerce.payment satisfies the rule before authoritative state is committed."
    ],
    "invalid": [
      "An implementation bypasses commerce.rule.subscriptionCapabilityGate and commits a conflicting or unverifiable state."
    ]
  },
  "implementationNotes": [
    "Enforce at the server-side commerce domain boundary.",
    "Use canonical Phase 11 schemas as the data model; do not create shadow transaction models.",
    "If provider behavior differs, translate through an adapter and reconcile to canonical NEXT F state."
  ],
  "futureBindings": {
    "events": "phase-13",
    "webhooks": "phase-14",
    "permissions": "phase-15",
    "siteManifest": "phase-16",
    "api": "phase-18"
  }
}
