{
  "$id": "commerce.rule.catalogRelationshipsValid",
  "name": "Catalog Relationships Valid",
  "version": "0.13.0",
  "status": "stable",
  "domain": "commerce",
  "category": "catalog-customers",
  "ruleKind": "entity-invariant",
  "description": "Catalog relations between Product, Variant, Category, Collection, Attribute and Inventory references must remain within the owning Site and reference eligible entities.",
  "purpose": "Catalog relations between Product, Variant, Category, Collection, Attribute and Inventory references must remain within the owning Site and reference eligible entities.",
  "severity": "critical",
  "configurable": false,
  "appliesTo": [
    "commerce.product",
    "commerce.productVariant",
    "commerce.productCategory",
    "commerce.productCollection"
  ],
  "enforcement": {
    "authority": "server",
    "timing": "before-mutation-or-publication",
    "atomicWhenRequired": true,
    "auditRequired": true,
    "clientValidationOnly": false
  },
  "requirements": [
    {
      "id": "commerce.rule.catalogRelationshipsValid.R1",
      "description": "Catalog relations between Product, Variant, Category, Collection, Attribute and Inventory references must remain within the owning Site and reference eligible entities."
    },
    {
      "id": "commerce.rule.catalogRelationshipsValid.R2",
      "description": "The rule must be evaluated from authoritative server-side state and must not trust browser-calculated or provider-reported state without required validation/reconciliation."
    }
  ],
  "failure": {
    "code": "COMMERCE_TENANT_SCOPE_VIOLATION",
    "retryable": false,
    "customerSafe": false,
    "notes": "Phase 12 defines the domain error identifier. HTTP mapping and response envelopes are reserved for Phase 18."
  },
  "relationships": [
    {
      "type": "governs",
      "target": "commerce.product",
      "description": "This rule constrains commerce.product operations or state."
    },
    {
      "type": "governs",
      "target": "commerce.productVariant",
      "description": "This rule constrains commerce.productVariant operations or state."
    },
    {
      "type": "governs",
      "target": "commerce.productCategory",
      "description": "This rule constrains commerce.productCategory operations or state."
    },
    {
      "type": "governs",
      "target": "commerce.productCollection",
      "description": "This rule constrains commerce.productCollection operations or state."
    }
  ],
  "examples": {
    "valid": [
      "An operation involving commerce.product, commerce.productVariant satisfies the rule before authoritative state is committed."
    ],
    "invalid": [
      "An implementation bypasses commerce.rule.catalogRelationshipsValid and commits a conflicting or unverifiable state."
    ]
  },
  "implementationNotes": [
    "Enforce at the server-side commerce domain boundary.",
    "Use canonical Phase 11 schemas as the data model; do not create shadow transaction models.",
    "If provider behavior differs, translate through an adapter and reconcile to canonical NEXT F state."
  ],
  "futureBindings": {
    "events": "phase-13",
    "webhooks": "phase-14",
    "permissions": "phase-15",
    "siteManifest": "phase-16",
    "api": "phase-18"
  }
}
