{
  "$id": "commerce.rule.returnStateTransition",
  "name": "Return State Transition",
  "version": "0.13.0",
  "status": "stable",
  "domain": "commerce",
  "category": "returns",
  "ruleKind": "return-invariant",
  "description": "Return lifecycle changes must follow the registered Return state machine and cannot skip required approval/receipt/resolution stages when policy requires them.",
  "purpose": "Return lifecycle changes must follow the registered Return state machine and cannot skip required approval/receipt/resolution stages when policy requires them.",
  "severity": "high",
  "configurable": true,
  "appliesTo": [
    "commerce.returnRequest"
  ],
  "enforcement": {
    "authority": "server",
    "timing": "before-and-after-return-transition",
    "atomicWhenRequired": true,
    "auditRequired": true,
    "clientValidationOnly": false
  },
  "requirements": [
    {
      "id": "commerce.rule.returnStateTransition.R1",
      "description": "Return lifecycle changes must follow the registered Return state machine and cannot skip required approval/receipt/resolution stages when policy requires them."
    },
    {
      "id": "commerce.rule.returnStateTransition.R2",
      "description": "The rule must be evaluated from authoritative server-side state and must not trust browser-calculated or provider-reported state without required validation/reconciliation."
    }
  ],
  "failure": {
    "code": "COMMERCE_INVALID_TRANSITION",
    "retryable": false,
    "customerSafe": true,
    "notes": "Phase 12 defines the domain error identifier. HTTP mapping and response envelopes are reserved for Phase 18."
  },
  "relationships": [
    {
      "type": "governs",
      "target": "commerce.returnRequest",
      "description": "This rule constrains commerce.returnRequest operations or state."
    }
  ],
  "examples": {
    "valid": [
      "An operation involving commerce.returnRequest satisfies the rule before authoritative state is committed."
    ],
    "invalid": [
      "An implementation bypasses commerce.rule.returnStateTransition and commits a conflicting or unverifiable state."
    ]
  },
  "implementationNotes": [
    "Enforce at the server-side commerce domain boundary.",
    "Use canonical Phase 11 schemas as the data model; do not create shadow transaction models.",
    "If provider behavior differs, translate through an adapter and reconcile to canonical NEXT F state."
  ],
  "futureBindings": {
    "events": "phase-13",
    "webhooks": "phase-14",
    "permissions": "phase-15",
    "siteManifest": "phase-16",
    "api": "phase-18"
  }
}
