{
  "$id": "commerce.rule.returnOwnershipScope",
  "name": "Return Ownership Scope",
  "version": "0.13.0",
  "status": "stable",
  "domain": "commerce",
  "category": "returns",
  "ruleKind": "return-invariant",
  "description": "A Return request must belong to the same Site and Order/customer scope as the items it references.",
  "purpose": "A Return request must belong to the same Site and Order/customer scope as the items it references.",
  "severity": "critical",
  "configurable": false,
  "appliesTo": [
    "commerce.returnRequest",
    "commerce.returnLine",
    "commerce.order"
  ],
  "enforcement": {
    "authority": "server",
    "timing": "before-and-after-return-transition",
    "atomicWhenRequired": true,
    "auditRequired": true,
    "clientValidationOnly": false
  },
  "requirements": [
    {
      "id": "commerce.rule.returnOwnershipScope.R1",
      "description": "A Return request must belong to the same Site and Order/customer scope as the items it references."
    },
    {
      "id": "commerce.rule.returnOwnershipScope.R2",
      "description": "The rule must be evaluated from authoritative server-side state and must not trust browser-calculated or provider-reported state without required validation/reconciliation."
    }
  ],
  "failure": {
    "code": "COMMERCE_TENANT_SCOPE_VIOLATION",
    "retryable": false,
    "customerSafe": false,
    "notes": "Phase 12 defines the domain error identifier. HTTP mapping and response envelopes are reserved for Phase 18."
  },
  "relationships": [
    {
      "type": "governs",
      "target": "commerce.returnRequest",
      "description": "This rule constrains commerce.returnRequest operations or state."
    },
    {
      "type": "governs",
      "target": "commerce.returnLine",
      "description": "This rule constrains commerce.returnLine operations or state."
    },
    {
      "type": "governs",
      "target": "commerce.order",
      "description": "This rule constrains commerce.order operations or state."
    }
  ],
  "examples": {
    "valid": [
      "An operation involving commerce.returnRequest, commerce.returnLine satisfies the rule before authoritative state is committed."
    ],
    "invalid": [
      "An implementation bypasses commerce.rule.returnOwnershipScope and commits a conflicting or unverifiable state."
    ]
  },
  "implementationNotes": [
    "Enforce at the server-side commerce domain boundary.",
    "Use canonical Phase 11 schemas as the data model; do not create shadow transaction models.",
    "If provider behavior differs, translate through an adapter and reconcile to canonical NEXT F state."
  ],
  "futureBindings": {
    "events": "phase-13",
    "webhooks": "phase-14",
    "permissions": "phase-15",
    "siteManifest": "phase-16",
    "api": "phase-18"
  }
}
