{
  "$id": "commerce.rule.verifiedReviewEvidenceDerived",
  "name": "Verified Review Evidence Derived",
  "version": "0.13.0",
  "status": "stable",
  "domain": "commerce",
  "category": "catalog-customers",
  "ruleKind": "entity-invariant",
  "description": "Verified-purchase review status must be derived from canonical purchase evidence and cannot be set merely by visitor/customer input.",
  "purpose": "Verified-purchase review status must be derived from canonical purchase evidence and cannot be set merely by visitor/customer input.",
  "severity": "high",
  "configurable": false,
  "appliesTo": [
    "commerce.productReview",
    "commerce.reviewModeration",
    "commerce.order"
  ],
  "enforcement": {
    "authority": "server",
    "timing": "before-mutation-or-publication",
    "atomicWhenRequired": false,
    "auditRequired": false,
    "clientValidationOnly": false
  },
  "requirements": [
    {
      "id": "commerce.rule.verifiedReviewEvidenceDerived.R1",
      "description": "Verified-purchase review status must be derived from canonical purchase evidence and cannot be set merely by visitor/customer input."
    },
    {
      "id": "commerce.rule.verifiedReviewEvidenceDerived.R2",
      "description": "The rule must be evaluated from authoritative server-side state and must not trust browser-calculated or provider-reported state without required validation/reconciliation."
    }
  ],
  "failure": {
    "code": "COMMERCE_RULE_VIOLATION",
    "retryable": false,
    "customerSafe": true,
    "notes": "Phase 12 defines the domain error identifier. HTTP mapping and response envelopes are reserved for Phase 18."
  },
  "relationships": [
    {
      "type": "governs",
      "target": "commerce.productReview",
      "description": "This rule constrains commerce.productReview operations or state."
    },
    {
      "type": "governs",
      "target": "commerce.reviewModeration",
      "description": "This rule constrains commerce.reviewModeration operations or state."
    },
    {
      "type": "governs",
      "target": "commerce.order",
      "description": "This rule constrains commerce.order operations or state."
    }
  ],
  "examples": {
    "valid": [
      "An operation involving commerce.productReview, commerce.reviewModeration satisfies the rule before authoritative state is committed."
    ],
    "invalid": [
      "An implementation bypasses commerce.rule.verifiedReviewEvidenceDerived and commits a conflicting or unverifiable state."
    ]
  },
  "implementationNotes": [
    "Enforce at the server-side commerce domain boundary.",
    "Use canonical Phase 11 schemas as the data model; do not create shadow transaction models.",
    "If provider behavior differs, translate through an adapter and reconcile to canonical NEXT F state."
  ],
  "futureBindings": {
    "events": "phase-13",
    "webhooks": "phase-14",
    "permissions": "phase-15",
    "siteManifest": "phase-16",
    "api": "phase-18"
  }
}
